{
  "stable_id": "arxiv:2505.08915",
  "reading_depth": "full_text",
  "source_provenance": {"source_locator": "https://export.arxiv.org/pdf/2505.08915", "pdf_sha256": "d53fea82492158ca4fe88e7ec37e3fe9d62c9c1e676decc8754398b9af19a4b9", "text_sha256": "e026034731a8e432b4cd8f7fcad9810ca0be706f0d815570f9e9a134fb7a146c", "page_count": 15, "extracted_at": "2026-08-23T16:54:28.938804+00:00", "review_pass": "primary-full-text-v1"},
  "question": "Under what data, initialization, and training-time conditions do linear-model training trajectories occupy a low-dimensional hyper-ribbon in prediction space?",
  "key_findings": [
    {"claim": "For full-batch linear regression, the covariance of residual trajectories decomposes into initialization, target, and cross terms whose spectra are controlled by the input Gram eigenvalues.", "evidence": "The closed-form gradient-descent dynamics turn each input eigendirection into a different decay timescale, permitting eigenvalue bounds on the PCA matrix of trajectories.", "anchors": [{"page": 4, "section": "Section II, linear regression dynamics"}, {"page": 6, "section": "Training-manifold covariance decomposition"}]},
    {"claim": "A rapidly decaying input spectrum, target scale large relative to initialization, and an intermediate training horizon produce the narrowest predicted hyper-ribbons.", "evidence": "Theorem 3 and phase diagrams separate regimes in slope, time, and target-to-weight scale; long training can add dimensions because slower modes enter the trajectory.", "anchors": [{"page": 7, "section": "Theorem 3 and numerical bound"}, {"page": 9, "section": "Phase diagram"}, {"page": 11, "section": "Discussion of controlling factors"}]},
    {"claim": "Kernel and stochastic-gradient extensions retain low-dimensionality only under additional spectral and noise assumptions.", "evidence": "The kernel ensemble result uses interlacing/bounds over component kernels, while the SGD covariance gains a noise term whose Gram geometry can increase effective dimension.", "anchors": [{"page": 10, "section": "Kernel machines"}, {"page": 11, "section": "Stochastic gradient descent extension"}]}
  ],
  "method": {"core_idea": "Explain an empirical low-dimensional prediction manifold by solving linear training dynamics and bounding the spectrum of its trajectory covariance.", "mechanism": "Diagonalize the input correlation operator, express residuals as mode-wise decays, decompose time-averaged covariance, and use Weyl/interlacing and displacement-rank arguments to identify phase boundaries.", "assumptions": ["Squared-loss linear regression with a stable fixed step size is a meaningful mechanistic surrogate for deep-network prediction paths.", "Inputs have an approximately geometric eigenspectrum and initial weights are isotropic.", "PCA dimension of sampled trajectory points captures the information-geometric hyper-ribbon notion used by the motivating study."]},
  "techniques": [{"id": "trajectory-covariance-decomposition", "role": "Separates initialization, target and interaction contributions to prediction-space dimension."}, {"id": "spectral-phase-bound", "role": "Relates effective dimension to data-spectrum decay, target scale and training horizon."}, {"id": "kernel-sgd-extension", "role": "Audits how ensembles and stochastic noise alter the same covariance geometry."}],
  "evaluations": [{"setting": "Synthetic linear regression across spectral slopes, initialization scales and horizons, with 100 initializations.", "metric": "PCA eigenvalues and dimensions needed to explain the trajectory covariance.", "result": "Numerical phase transitions follow the analytic bounds qualitatively.", "baseline": "Direct eigendecomposition of simulated trajectories and the deep-network manifold phenomenon from prior work."}],
  "limitations": ["The main theorem is for linear squared-loss dynamics, not nonlinear feature learning.", "Low-dimensional PCA in residual space is not identical to low-dimensionality under every information-geometric embedding.", "Geometric data spectra and isotropic initialization are strong simplifying assumptions.", "The bounds can be loose, as the observed displacement-rank decay is better than the proof uses."],
  "failure_modes": ["Flat input spectra or long horizons activate many slow modes and widen the manifold.", "Large SGD noise in nonsloppy directions can destroy the predicted ribbon.", "A nonlinear network can change its kernel and leave the fixed-spectrum regime."],
  "reusable_insights": ["Training-time horizon is part of any claimed intrinsic dimension, not merely a sampling detail.", "Prediction-path dimension can often be separated into data geometry, target geometry, initialization and optimizer noise.", "A solvable linear surrogate is strongest when its terms are mapped to falsifiable deep-network measurements."],
  "open_questions": ["Do time-varying neural tangent kernels predict the same phase boundaries in deep networks?", "Can the theory forecast manifold dimension before training from a real dataset spectrum?", "How does adaptive optimization change the noise and mode timescales?"],
  "competitive_landscape": [
    {"canonical_id": "arxiv:2305.01604", "title": "The Training Process of Many Deep Networks Explores the Same Low-Dimensional Manifold", "url": "https://arxiv.org/abs/2305.01604", "relationship": "Direct empirical precursor and motivating phenomenon.", "difference": "Mao et al. establish a shared prediction-space manifold across many deep models; the target analytically explains a linear analogue and isolates spectral phase controls."},
    {"canonical_id": "arxiv:2110.14163", "title": "Does the Data Induce Capacity Control in Deep Learning?", "url": "https://arxiv.org/abs/2110.14163", "relationship": "Closest data-sloppiness and Fisher-spectrum account.", "difference": "Yang et al. connect sloppy input, Hessian/Fisher spectra, and generalization; the target focuses on the covariance of entire training trajectories and its time-dependent dimension."},
    {"canonical_id": "arxiv:1501.07668", "title": "Sloppiness and Emergent Theories in Physics, Biology, and Beyond", "url": "https://arxiv.org/abs/1501.07668", "relationship": "Foundational model-manifold sloppiness framework.", "difference": "The earlier work studies parameter sensitivities and emergent effective theories broadly; the target derives a supervised-learning trajectory result in prediction space."}
  ],
  "novelty_assessment": "The paper supplies a useful exact linear-model decomposition for a known deep-network manifold observation. Its novelty is the phase-boundary analysis, not discovery of sloppiness or low-dimensional training trajectories, and transfer to nonlinear representation learning remains conjectural.",
  "confidence": 0.92,
  "reviewer_notes": "Read all 15 extracted pages, including theorem proofs, phase plots, kernel/SGD extensions, and the discussion of looseness. Primary-source competitors were checked on 2026-08-23."
}
