{
  "stable_id": "openreview:WA35e2vPlFT",
  "reading_depth": "full_text",
  "source_provenance": {"source_locator": "https://export.arxiv.org/pdf/2206.11267", "pdf_sha256": "3386f6217e96cf8bcce690be626361e47005d364dc6009c5b8d8803fec03e962", "text_sha256": "c91472b718dcd9dd4b61479059056d173d9b8623be7dd2274a940f784527145e", "page_count": 26, "extracted_at": "2026-08-24T00:31:48.332793+00:00", "review_pass": "primary-full-text-v1"},
  "question": "Can density estimation on an unknown low-dimensional manifold avoid the topological restrictions of a single injective latent chart?",
  "key_findings": [
    {"claim": "The paper motivates implicit level sets by showing that a single injective Euclidean latent map cannot faithfully represent arbitrary manifold topology without severe geometric distortion.", "evidence": "A pushforward model from R^m inherits single-chart topology; when forced toward a mismatched manifold, its bi-Lipschitz behavior can diverge and invalidate density estimates even if samples look close.", "anchors": [{"page": 3, "section": "Section 2, Topological limitations of pushforward models"}, {"page": 4, "section": "Geometry and density consequences"}]},
    {"claim": "EBIM separates topology-aware manifold learning from density learning on the recovered zero set.", "evidence": "It trains F from ambient space to codimension coordinates so data map to zero, contrasts them with Langevin-sampled negatives under ||F||, and adds a full-rank Jacobian penalty; a second energy model is then trained and sampled with Langevin dynamics constrained to F(x)=0.", "anchors": [{"page": 5, "section": "Section 3, Energy-based implicit manifolds"}, {"page": 7, "section": "Jacobian regularization and manifold arithmetic"}, {"page": 8, "section": "Section 4, Density estimation on the manifold"}, {"page": 9, "section": "Constrained sampling"}]},
    {"claim": "The model improves topology-sensitive synthetic distribution fit and MNIST FID, but is neither uniformly best nor shown scalable.", "evidence": "Reported Wasserstein-1 values beat the pushforward EBM on von Mises, geospatial, and amino-acid data; FID is 15.3 on MNIST versus 17.0 for NAE, while Fashion-MNIST EBIM at 30.7 trails NAE at 28.2. The authors identify constrained sampling and scaling as open limitations.", "anchors": [{"page": 11, "section": "Section 5.2, Synthetic and scientific distributions"}, {"page": 12, "section": "Image FID results"}, {"page": 14, "section": "Limitations and conclusion"}, {"page": 22, "section": "Appendix implementation and timing caveats"}]}
  ],
  "method": {"core_idea": "Represent a manifold as a neural vector-valued zero set, then learn probability mass intrinsically on that set with a constrained energy-based model.", "mechanism": "Fit F(x)=0 on data using contrastive negative sampling and Jacobian-rank regularization, optionally compose zero sets by implicit manifold arithmetic, then train a separate energy E on the learned manifold and project Langevin updates onto its tangent space with Jacobian-vector products and iterative solvers.", "assumptions": ["The intrinsic dimension or codimension is known and the target support is a sufficiently regular manifold.", "The Jacobian of F is full rank near the learned zero set.", "Negative and constrained Langevin chains mix well enough to approximate their intended distributions."]},
  "techniques": [{"id": "neural-implicit-manifold", "role": "Represents non-single-chart topology as a regular zero set."}, {"id": "contrastive-level-set-learning", "role": "Attracts data to zero while pushing sampled ambient negatives away."}, {"id": "constrained-manifold-ebm", "role": "Learns and samples a density tangent to the recovered surface."}, {"id": "implicit-manifold-arithmetic", "role": "Builds unions and intersections from learned implicit functions."}],
  "evaluations": [{"setting": "Synthetic topological distributions, geospatial and amino-acid data, MNIST, and Fashion-MNIST.", "metric": "Wasserstein-1 distance, FID, qualitative topology, and out-of-distribution energy behavior.", "result": "EBIM wins the paper's three reported W1 comparisons and MNIST FID, but loses Fashion-MNIST FID to NAE and exposes unreliable OOD scoring and slow constrained sampling.", "baseline": "Pushforward EBM, autoencoder/VAE plus EBM, normalized autoencoder, and standard manifold-density approaches."}],
  "limitations": ["Intrinsic dimension must be specified and singular or stratified supports violate the regular-level-set model.", "Two nested MCMC procedures introduce mixing, tuning, and computational problems.", "Projection uses iterative linear algebra and optimization that is costly in high ambient dimension.", "Image experiments are small-scale, hyperparameters were visually tuned, and raw timing comparisons are explicitly discouraged."],
  "failure_modes": ["F maps both data and broad ambient regions near zero, creating spurious manifold components.", "A rank-deficient Jacobian makes tangent projection undefined or numerically unstable.", "Negative Langevin chains fail to explore alternative components, so topology is learned incompletely.", "The density energy assigns misleading scores to OOD samples despite plausible generation."],
  "reusable_insights": ["Manifold topology and density fit are separable failure axes and deserve separate diagnostics.", "Implicit zero sets remove global-chart topology constraints but trade them for regularity and sampling assumptions.", "Validate generative manifold models with topology, intrinsic density, OOD behavior, and sampling cost rather than FID alone."],
  "open_questions": ["Can score-based or amortized samplers replace both expensive Langevin loops?", "How can intrinsic dimension, disconnected components, and singular strata be inferred rather than prescribed?", "What diagnostics detect spurious zero-set components before density training?"],
  "competitive_landscape": [
    {"canonical_id": "arxiv:2003.13913", "title": "Flows for simultaneous manifold learning and density estimation", "url": "https://arxiv.org/abs/2003.13913", "relationship": "Direct joint manifold-density precursor (M-flows).", "difference": "M-flows use an injective latent chart and separate manifold/density updates; EBIM uses an ambient implicit zero set to admit topologies that a single chart cannot represent."},
    {"canonical_id": "arxiv:2106.01413", "title": "Rectangular Flows for Manifold Learning", "url": "https://arxiv.org/abs/2106.01413", "relationship": "Direct injective-flow competitor with tractable volume-gradient estimators.", "difference": "Rectangular flows retain a low-to-high injective parameterization and calculate its volume change; EBIM abandons global parameterization and pays for constrained MCMC on an implicit manifold."},
    {"canonical_id": "arxiv:2106.05275", "title": "Tractable Density Estimation on Learned Manifolds with Conformal Embedding Flows", "url": "https://arxiv.org/abs/2106.05275", "relationship": "Primary tractable-density learned-manifold competitor.", "difference": "Conformal embedding flows preserve exact likelihoods by restricting the injective map; EBIM is topologically more flexible but uses an unnormalized energy and expensive constrained sampling."}
  ],
  "novelty_assessment": "The two-stage implicit-zero-set plus constrained-EBM construction directly addresses a genuine topology limitation of injective flows and adds useful manifold composition. It replaces chart restrictions with demanding MCMC, rank-regularity, and scalability assumptions, so the contribution is strongest as a topology-aware modeling framework rather than a production density estimator.",
  "confidence": 0.96,
  "reviewer_notes": "Read all 26 extracted pages, including topology arguments, algorithms, quantitative tables, and appendix disclosures. Primary M-flow, rectangular-flow, and conformal-embedding-flow records were checked on arXiv/NeurIPS on 2026-08-23."
}
