{
  "stable_id": "arxiv:2305.06435",
  "reading_depth": "full_text",
  "source_provenance": {"source_locator": "https://export.arxiv.org/pdf/2305.06435", "pdf_sha256": "36af143f1a715d67c17425f71803c0a4cf2cd715c49db341496d83a577c98a4b", "text_sha256": "61ffe86042c1ad09b879fe9d4157bc7ac2495cf796826a4d9d03cff1ec39de5a", "page_count": 16, "extracted_at": "2026-08-23T19:42:58.645238+00:00", "review_pass": "primary-full-text-v1"},
  "question": "Can mini-batch size cause sharp learnability transitions in sparse-teacher two-layer networks, and does a critical batch reflect information needed per update?",
  "key_findings": [
    {"claim": "Three sparse teacher-student settings exhibit sharp batch-size thresholds separating failed from successful recovery or generalization.", "evidence": "With known sparse topology and multi-output networks, validation loss and Hamming distance jump to exact recovery above m_c; topology mismatch yields continuous transitions for teacher degree 2 and discontinuous ones for higher degree; a scalar-output model shows a sharp good-generalization transition.", "anchors": [{"page": 3, "section": "2 Summary of main results"}, {"page": 6, "section": "4.1 Optimal-case results"}, {"page": 9, "section": "4.2 Mismatch results"}]},
    {"claim": "Observed critical batches scale with the number of unknowns relative to information supplied by one example.", "evidence": "In the two-matrix multi-output case m_c grows approximately linearly with connectivity d; in the scalar-output one-matrix case m_c scales approximately as dN, matching the paper's parameter-counting argument.", "anchors": [{"page": 7, "section": "Figure 3"}, {"page": 11, "section": "Figure 7 / scaling argument"}]},
    {"claim": "A dense real-valued student trained with SGD has a broad optimal batch region jointly controlled by learning rate, not an established universal discontinuity.", "evidence": "For sparse-teacher/dense-student experiments, m=1 is trapped at high loss, performance improves to around m=64 in a shown setting and then saturates or worsens; the final-loss heatmap varies by orders of magnitude over learning-rate/batch pairs.", "anchors": [{"page": 12, "section": "4.4 Dense student"}, {"page": 13, "section": "Figure 8 / Discussion"}]}
  ],
  "method": {"core_idea": "Sweep mini-batch size in controlled online teacher-student problems while measuring exact weight recovery and held-out generalization.", "mechanism": "Sparse binary students use a zero-temperature Metropolis/greedy update whose batch noise changes acceptance; dense continuous students use fixed-rate SGD. Four architectures vary topology knowledge, output dimension, and student density.", "assumptions": ["Fresh online Gaussian examples make finite-data reuse negligible.", "Sparse two-layer planted teachers are informative proxies for practical deep networks.", "Fixed update budgets and tuned learning rates permit fair comparison across batch sizes."]},
  "techniques": [{"id": "planted-sparse-teacher", "role": "Provides exact ground-truth weights and unlimited labeled samples."}, {"id": "batch-size-phase-sweep", "role": "Measures sharp changes in loss, Hamming distance, TP/TN, and success probability."}, {"id": "information-count-scaling", "role": "Relates empirical m_c to connectivity, width, and output dimension."}],
  "evaluations": [{"setting": "Sparse teacher/student with known binary topology", "metric": "Validation loss and normalized Hamming distance", "result": "For connectivity d>2, both show a discontinuous transition to exact inference; fitted m_c is roughly linear in d.", "baseline": "Batches below and above the empirical critical value"}, {"setting": "Sparse topology-mismatch and scalar-output students", "metric": "Weight TP/TN, success rate, and validation loss", "result": "Topology noise shifts m_c upward and can change transition order; scalar-output good-generalization thresholds scale about dN.", "baseline": "Matched topology and smaller mini-batches"}, {"setting": "Dense real-valued student with N=32/64", "metric": "Validation loss after up to one million SGD steps", "result": "Loss improves by orders of magnitude as batch increases to a learning-rate-dependent optimum, then plateaus or worsens.", "baseline": "m=1 and non-optimal learning-rate/batch pairs"}],
  "limitations": ["Results are numerical rather than a derivation of m_c or transition order.", "All tasks use synthetic two-layer planted teachers, fresh Gaussian data, and narrow width/connectivity ranges.", "Compute is compared by SGD steps rather than examples, epochs, or wall clock, so larger batches consume more data per reported step."],
  "failure_modes": ["Small batches inject enough noise to trap the studied zero-temperature or SGD dynamics in glassy states.", "Overly large batches reduce beneficial noise and can settle in slightly suboptimal minima.", "Changing learning rate, output dimension, topology mismatch, or budget moves or smooths the apparent threshold."],
  "reusable_insights": ["Batch-size studies must sweep learning rate jointly and normalize comparison by samples and compute.", "Planted tasks can distinguish function generalization from exact parameter recovery.", "Parameter-to-information counting provides a testable scaling hypothesis, not a universal batch prescription."],
  "open_questions": ["Do abrupt batch thresholds persist in deep transformers and convolutional networks under compute-matched training?", "Can dynamical mean-field or landscape theory predict m_c and transition order?", "Can online statistics detect proximity to a batch-induced trapping regime during training?"],
  "competitive_landscape": [
    {"canonical_id": "arxiv:1804.07612", "title": "Revisiting Small Batch Training for Deep Neural Networks", "url": "https://arxiv.org/abs/1804.07612", "relationship": "empirical batch-size predecessor", "difference": "Masters and Luschi report small-batch optimization/generalization behavior on practical networks; this work finds opposite-direction minimum-batch thresholds in controlled sparse teacher-student tasks."},
    {"canonical_id": "arxiv:1911.06459", "title": "Optimal Mini-Batch Size Selection for Fast Gradient Descent", "url": "https://arxiv.org/abs/1911.06459", "relationship": "batch-selection competitor", "difference": "That work models time-optimal batch choice through empirical performance laws; this paper emphasizes learnability phase transitions and connectivity scaling."},
    {"canonical_id": "arxiv:2202.00293", "title": "Phase diagram of Stochastic Gradient Descent in high-dimensional two-layer neural networks", "url": "https://arxiv.org/abs/2202.00293", "relationship": "direct statistical-mechanics predecessor", "difference": "Veiga et al. derive high-dimensional SGD phases primarily in an online/dense setting; the reviewed paper varies mini-batch size explicitly and includes sparse binary topology recovery."},
    {"canonical_id": "arxiv:1711.00489", "title": "Don't Decay the Learning Rate, Increase the Batch Size", "url": "https://arxiv.org/abs/1711.00489", "relationship": "batch-scheduling predecessor", "difference": "Smith et al. trade increasing batches for learning-rate decay in practical training; this study holds schedules simple to isolate critical fixed-batch behavior."}
  ],
  "novelty_assessment": "Reviewer inference: batch-size heuristics, scaling laws, and SGD phase diagrams predate the paper. Its specific contribution is numerical evidence of sharp batch-controlled recovery transitions across several sparse planted two-layer settings, with simple information-count scaling.",
  "confidence": 0.9,
  "reviewer_notes": "All models, algorithms, phase plots, scaling arguments, dense-student sweep, and discussion were checked. Primary competitor records checked 2026-08-23. The phase-transition language is well supported numerically in selected cases but not a general theorem."
}
